{
  "$schema_version": "ni-spec/2.0",
  "meta": {
    "spec_version": "v0.4.0"
  },
  "csr_policy": {
    "sub_word_write": "slverr",
    "unmapped_read": "decerr",
    "misaligned": "slverr",
    "wo_read": "zero"
  },
  "registers": [
    {
      "offset": "0x040",
      "name": "PKT_PROBE_EN",
      "kind": "register",
      "access": "RW",
      "reset_expr": "0x0",
      "width_expr": "32"
    },
    {
      "offset": "0x044",
      "name": "PKT_PROBE_MODE",
      "kind": "register",
      "access": "RW",
      "reset_expr": "0x0",
      "width_expr": "32"
    },
    {
      "offset": "0x048",
      "name": "PKT_WINDOW_SIZE",
      "kind": "register",
      "access": "RW",
      "reset_expr": "0x0",
      "width_expr": "32"
    },
    {
      "offset": "0x04C",
      "name": "PKT_BYTE_COUNT",
      "kind": "register",
      "access": "RO",
      "reset_expr": "0x0",
      "width_expr": "32"
    },
    {
      "offset": "0x050",
      "name": "PKT_BANDWIDTH",
      "kind": "register",
      "access": "RO",
      "reset_expr": "0x0",
      "width_expr": "32"
    },
    {
      "offset": "0x060",
      "name": "TXN_PROBE_EN",
      "kind": "register",
      "access": "RW",
      "reset_expr": "0x0",
      "width_expr": "32"
    },
    {
      "offset": "0x064",
      "name": "TXN_THRESHOLD_0",
      "kind": "register",
      "access": "RW",
      "reset_expr": "0x0",
      "width_expr": "32"
    },
    {
      "offset": "0x068",
      "name": "TXN_THRESHOLD_1",
      "kind": "register",
      "access": "RW",
      "reset_expr": "0x0",
      "width_expr": "32"
    },
    {
      "offset": "0x06C",
      "name": "TXN_THRESHOLD_2",
      "kind": "register",
      "access": "RW",
      "reset_expr": "0x0",
      "width_expr": "32"
    },
    {
      "offset": "0x070",
      "name": "TXN_THRESHOLD_3",
      "kind": "register",
      "access": "RW",
      "reset_expr": "0x0",
      "width_expr": "32"
    },
    {
      "offset": "0x080",
      "name": "TXN_BIN_0_COUNT",
      "kind": "register",
      "access": "RO",
      "reset_expr": "0x0",
      "width_expr": "32"
    },
    {
      "offset": "0x084",
      "name": "TXN_BIN_1_COUNT",
      "kind": "register",
      "access": "RO",
      "reset_expr": "0x0",
      "width_expr": "32"
    },
    {
      "offset": "0x088",
      "name": "TXN_BIN_2_COUNT",
      "kind": "register",
      "access": "RO",
      "reset_expr": "0x0",
      "width_expr": "32"
    },
    {
      "offset": "0x08C",
      "name": "TXN_BIN_3_COUNT",
      "kind": "register",
      "access": "RO",
      "reset_expr": "0x0",
      "width_expr": "32"
    },
    {
      "offset": "0x090",
      "name": "TXN_BIN_4_COUNT",
      "kind": "register",
      "access": "RO",
      "reset_expr": "0x0",
      "width_expr": "32"
    },
    {
      "offset": "0x094",
      "name": "TXN_MIN_LATENCY",
      "kind": "register",
      "access": "RO",
      "reset_expr": "0xFFFF",
      "width_expr": "32"
    },
    {
      "offset": "0x098",
      "name": "TXN_MAX_LATENCY",
      "kind": "register",
      "access": "RO",
      "reset_expr": "0x0",
      "width_expr": "32"
    },
    {
      "offset": "0x09C",
      "name": "TXN_TOTAL_COUNT",
      "kind": "register",
      "access": "RO",
      "reset_expr": "0x0",
      "width_expr": "32"
    },
    {
      "offset": "0x100",
      "name": "ERR_STATUS",
      "kind": "register",
      "access": "RW1C",
      "reset_expr": "0x0",
      "width_expr": "32",
      "fields": [
        {
          "name": "ecc_uncorr_err",
          "bit_high": 0,
          "bit_low": 0,
          "reset": "0x0",
          "description": "flit_ecc 雙位元錯偵測到 (corrupted flit forwarded; AXI rresp 不變). Write 1 clears bit + `ECC_UNCORR_ERR_CNT`."
        },
        {
          "name": "route_par_err",
          "bit_high": 1,
          "bit_low": 1,
          "reset": "0x0",
          "description": "route_par mismatch detected by router or NI sink (offending flit dropped). Write 1 clears bit + `ROUTE_PAR_ERR_CNT`."
        },
        {
          "name": "axi_parity_err",
          "bit_high": 2,
          "bit_low": 2,
          "reset": "0x0",
          "description": "AXI host-side parity mismatch (NMU-side AW/AR/W input parity OR NSU-side rdata parity). Transaction is logged but not aborted. Write 1 clears bit + `AXI_PARITY_ERR_CNT`."
        }
      ]
    },
    {
      "offset": "0x108",
      "name": "ECC_UNCORR_ERR_CNT",
      "kind": "register",
      "access": "RO",
      "reset_expr": "0x0",
      "width_expr": "32"
    },
    {
      "offset": "0x10C",
      "name": "LAST_ERR_INFO",
      "kind": "register",
      "access": "RO",
      "reset_expr": "0x0",
      "width_expr": "32",
      "fields": [
        {
          "name": "err_axi_id",
          "bit_high": 7,
          "bit_low": 0,
          "reset": "0x0",
          "description": "錯誤 transaction 的 AXI ID."
        },
        {
          "name": "err_src_id",
          "bit_high": 15,
          "bit_low": 8,
          "reset": "0x0",
          "description": "錯誤來源 node ID."
        },
        {
          "name": "err_dst_id",
          "bit_high": 23,
          "bit_low": 16,
          "reset": "0x0",
          "description": "錯誤目標 node ID."
        }
      ]
    },
    {
      "offset": "0x110",
      "name": "(reserved for `LAST_ERR_INFO_HI`)",
      "kind": "reserved",
      "access": null,
      "reset_expr": null
    },
    {
      "offset": "0x114",
      "name": "IRQ_ENABLE",
      "kind": "register",
      "access": "RW",
      "reset_expr": "0x0",
      "width_expr": "32",
      "fields": [
        {
          "name": "ecc_uncorr_irq_en",
          "bit_high": 0,
          "bit_low": 0,
          "reset": "0x0",
          "description": "Allow `ERR_STATUS[0]` to drive `irq_o`."
        },
        {
          "name": "route_par_irq_en",
          "bit_high": 1,
          "bit_low": 1,
          "reset": "0x0",
          "description": "Allow `ERR_STATUS[1]` to drive `irq_o`."
        },
        {
          "name": "axi_parity_irq_en",
          "bit_high": 2,
          "bit_low": 2,
          "reset": "0x0",
          "description": "Allow `ERR_STATUS[2]` to drive `irq_o`."
        }
      ]
    },
    {
      "offset": "0x118",
      "name": "ECC_CORR_ERR_CNT",
      "kind": "register",
      "access": "RO",
      "reset_expr": "0x0",
      "width_expr": "32"
    },
    {
      "offset": "0x11C",
      "name": "ROUTE_PAR_ERR_CNT",
      "kind": "register",
      "access": "RO",
      "reset_expr": "0x0",
      "width_expr": "32"
    },
    {
      "offset": "0x120",
      "name": "AXI_PARITY_ERR_CNT",
      "kind": "register",
      "access": "RO",
      "reset_expr": "0x0",
      "width_expr": "32"
    },
    {
      "offset": "0x130",
      "name": "PENDING_R_COUNT",
      "kind": "register",
      "access": "RO",
      "reset_expr": "0x0",
      "width_expr": "32"
    },
    {
      "offset": "0x134",
      "name": "PENDING_W_COUNT",
      "kind": "register",
      "access": "RO",
      "reset_expr": "0x0",
      "width_expr": "32"
    },
    {
      "offset": "0x13C",
      "name": "QUIESCE_CTRL",
      "kind": "register",
      "access": "RW",
      "reset_expr": "0x0",
      "width_expr": "32",
      "fields": [
        {
          "name": "quiesce_req",
          "bit_high": 0,
          "bit_low": 0,
          "reset": "0x0",
          "description": "Software requests NMU quiesce. `1`: NMU stops accepting new AW/AR (holds `axi_awready_o = axi_arready_o = 0`); existing in-flight transactions drain via normal response paths. `0`: resume normal NMU operation. NSU continues servicing inbound NoC requests in either state — quiesce is NMU-only by design."
        }
      ]
    },
    {
      "offset": "0x140",
      "name": "QUIESCE_STATUS",
      "kind": "register",
      "access": "RO",
      "reset_expr": "0x0",
      "width_expr": "32",
      "fields": [
        {
          "name": "quiesce_idle",
          "bit_high": 0,
          "bit_low": 0,
          "reset": "0x0",
          "description": "Asserts when `(QUIESCE_CTRL.quiesce_req=1) AND (PENDING_R_COUNT=0) AND (PENDING_W_COUNT=0)`. Combinational over `aclk_i`-domain values (no CDC). Software polls this bit after writing `quiesce_req=1` to know when reconfig is safe. Polling is best-effort — no NI-side liveness guarantee in v0.4.0. If a slave hangs, `quiesce_idle` never asserts and software handles upper-bounded retry / reset externally. Deasserts on the cycle `quiesce_req` is cleared (because the AND-condition's first term goes false)."
        }
      ]
    },
    {
      "offset": "0x144",
      "name": "EXCLUSIVE_MONITOR_CTRL",
      "kind": "register",
      "access": "WO",
      "reset_expr": "0x0",
      "width_expr": "32",
      "fields": [
        {
          "name": "clear_all",
          "bit_high": 0,
          "bit_low": 0,
          "reset": "0x0",
          "description": "Write-1 self-clearing trigger: invalidates all pending NSU Exclusive Monitor entries on the `aclk_i` edge that completes the CSR write handshake (the \"clear epoch\" boundary). The bit self-clears on the next `aclk_i` edge after the clear epoch (latency = 1 cycle); subsequent reads return 0. Use case: OS bookkeeping when a process is killed mid-Exclusive. Race semantics with concurrent NSU events formalised in `protocol_rules.md` `NI_CFG_EXCLUSIVE_CLEAR_RACE`."
        }
      ]
    },
    {
      "offset": "0x148",
      "name": "EXCLUSIVE_MONITOR_STATUS",
      "kind": "register",
      "access": "RO",
      "reset_expr": "0x0",
      "width_expr": "32"
    }
  ]
}
